Title,Date,Author,Content
                        Planned Parenthood to offer free HIV testing        ,"June 21, 2017",Amanda Cuda,"        National HIV Testing Day is a reminder that getting tested for HIV is an important step in stopping the spread of HIV and taking care of your health. In the United States, more than 1.1 million people are living ... "
                        Stand-alone video: An end to AIDS?        ,"May 3, 2019",Bloomberg,"        Bloomberg Stand-alone video: It would be the end of new AIDS cases if everyone with HIV were fully treated, according to a new study published in the Lancet.     "
                        ON THE CALENDAR        ,"June 27, 2006",Copyright 2006 Houston Chronicle,"        Copyright 2006 Houston Chronicle Today • HIV/AIDS town hall meeting: 6 to 8 p.m. at Wheeler Avenue Baptist Church, 3826 Wheeler. There will be a town hall meeting on HIV and AIDS in the black community. Free HIV tests will be available.     "
                        Bering Omega Community Services seeking donations        ,"October 31, 2013",None,        The Omega House is an eight-bed residential hospice for people in the late stages of HIV/AIDS.     
                        State to labs: report all results of tests for 3 diseases        ,"May 29, 2019",None,"        (AP) - Louisiana's Department of Health says laboratories must now report all test results for HIV, syphilis and hepatitis C - even tests indicating someone doesn't have the ailment.     "
                        Tracking progress on World AIDS Day        ,"November 30, 2011",Houston Chronicle,"        At the end of 2009, 22.5 million adults and children in sub-Saharan Africa were living with HIV/AIDS, there were 1.8 million adults and children newly infected with the virus, and 1.3 million died, according to ... "
                        Frances Gerdes        ,"December 28, 2015",None,"        Frances, 78, truly loved life and possessed a unique ability to connect with others.She leaves behind many who appreciated her positive, open and gentle charisma… whom were touched by her unconditional ... "
                        Affidavit: Connecticut murder suspect said victim was spreading HIV ,"September 18, 2017",The Associated Press,        The Associated Press NEW LONDON  Court documents show a man accused of fatally shooting his cousin in Connecticut told police the victim was spreading HIV through their Native American tribe. ... An affidavit ... 
"                        DOH: Capital Region sees highest percentage increase in HIV, STDs than rest of state        ","February 20, 2018",Lynda Edwards,"        And the stats for HIV and gonorrhea were equally troubling. ... Preliminary HIV data for 2017 continue to show an increase in this area."" ... (HIV skews much older).     "
                        San Antonio mayor urges everyone to get tested for HIV ,"October 11, 2017",Sarah Ravani,"        The target's goals are for 90 percent of people with HIV to know their status, 90 percent of people with HIV getting treatment and 90 percent of people being treated for HIV to have suppressed viral loads. ... "
                        Dine out for a cause during Dine Out for Life April 30        ,"April 20, 2015",Greg Morago,        Food Chronicles Greg Morago More than 40 Houston restaurants are participating in Dining Out for Life on April 30 - a one-day-only effort where diners can support HIV/AIDS prevention by eating at one of their favorite spots.     
                        A new pill to treat HIV just got approved - and it could shake up a $22 billion market (GILD)        ,"February 7, 2018",Lydia Ramsey,"        The new approval could shake up the $22 billion HIV drug market. The FDA just approved a new, once-a-day pill to treat HIV. ... New HIV Guidelines FILE-- ﻿The FDA just approved a new, once-a-day pill to treat HIV.     "
                        Julián Castro calls White House's plan to crack down on recreational pot 'a mistake'        ,"February 28, 2017",Kelsey Bradshaw,"        More than 71 percent of Florida voters approved an amendment allowing people with a variety of medical conditions legal access to marijuana, including those with HIV, multiple sclerosis, post-traumatic stress syndrome, epilepsy and Crohn's disease.     "
"                        With HIV on the rise in Bexar County, Metro Health organizes summit for Wednesday        ","October 9, 2017",Sarah Ravani,"        By Sarah Ravani, Staff Writer The San Antonio Metropolitan Health District is holding a daylong forum Wednesday with community leaders and people living with HIV to discuss strategies to stop the spread of HIV ... "
                        British police uncover massive marijuana operation in nuclear bunker        ,"February 23, 2017",John-Henry Perera,"        More than 71 percent of Florida voters approved an amendment allowing people with a variety of medical conditions legal access to marijuana, including those with HIV, multiple sclerosis, post-traumatic stress syndrome, epilepsy and Crohn's disease.     "
"                        Mother Teresa to be canonized in September, Pope Francis says        ","March 15, 2016",Allan Turner,"        Teresa founded Missionaries of  Charity, which operated mobile clinics, orphanages, schools, soup kitchens and dispensaries and homes for people suffering HIV/AIDS, leprosy and tuberculosis.     "
"                        Pete Burns, Dead or Alive founder, dies at 57        ","October 24, 2016",Linda Ge,"        Read original story Pete Burns, Dead or Alive Founder, Dies at 57 At TheWrap Pete Burns (L) and boyfriend Michael Simpson attend the VIP launch party for Gap (Red), the stores new colour-themed brand where 50% ... "
                        Houston Legal Links 11/22/2016        ,"November 22, 2016",Mary Flood,        Houston Legal Mary Flood Possible motive revealed in S.A. officer’s killing UTMB pays $33K fine to settle complaints about treatment of research monkeys BP fine proceeds boost environmental projects in ... 
                        Victoria Beckham selling off her designer clothes        ,"August 5, 2014",Daily Dish,        The Spice Girls star-turned-fashion designer decided to offload pieces from her personal collection after a heartbreaking trip to South Africa earlier this year during which she visited mothers living with HIV. ... 
"                        Veuve, tacos, and drag: inside Legacy Community Health's epic #SundayFunday        ","July 17, 2017",Amber Elliott,"        For the past 15 years, the non-profit has hosted the always-free drag show with proceeds befitting HIV/AIDS programs and services.     "
                        Travel-related Zika virus identified in Galveston county        ,"August 1, 2016",None,"        Examples of GCHD public health services include Air & Water Pollution Services, Community Outreach, Consumer Health Services, Epidemiology, Immunizations, Public Information, Public Health Preparedness, STD/HIV ... "
                        Report finds 'severe' AIDS rate in nation's capital        ,"March 15, 2009",Washington Post,"        That translates into 2,984 residents per every 100,000 over the age of 12 - or 15,120 - according to the 2008 epidemiology report by the District's HIV/AIDS office. ... Together, the reports offer a sobering ... "
                        Bill Gates says we're on track for a record HIV epidemic        ,"September 13, 2017",Chris Weller,"HIV infection is one of the first metrics listed in the 2017 ""Goalkeepers"" report. ... Bill and Melinda Gates Foundation But funding gains for HIV control are slowing. ... The East African country encourages ... "
                        A&M doctor: Drink water when you're thirsty        ,"May 29, 2014",Carol Christian,"        A: When I was an intern in medicine, the feeling was that HIV infection was going to be the single biggest challenge we were going to face. ... We now consider HIV a manageable chronic condition. I see patients ... "
                        Dr. Joseph Gathe Jr.: Support bill to implement recommendations on AIDS        ,"December 1, 2008",DR. JOSEPH GATHE JR.,"        Measure would require providers to offer HIV tests DR. ... Currently, one in 378 Texans is living with HIV/AIDS. ... It has been 27 years since HIV and AIDS entered our public consciousness.     "
                        Another Voice: Pope Benedict XVI is wrong        ,"March 21, 2009",The Washington Post,"        Are condoms foolproof protection against infection by HIV, which causes AIDS? ... According to UNAIDS, the Joint United Nations Program on HIV/AIDS, sub-Saharan Africa is the epidemic's center, with 67 percent ... "
                        CDC: The most distinctive causes of deaths in the U.S.        ,"May 19, 2015",Matt Levin,"        ""The resulting map depicts a variety of distinctive causes of death based on a wide range of number of deaths, from 15,000 deaths from HIV in Florida to 679 deaths from tuberculosis in Texas to 22 deaths from ... "
                        Sports Illustrated's all-time Sportspersons of the Year        ,"December 4, 2017",None,"        ., baseball's consecutive games played record Sportsman 1994.jpg 1994 Sports Illustrated Sportspeople of the Year Bonnie Blair, Johann Olav Koss, Olympic gold medalists Sportsman 1993.jpg 1993 Sports Illustrated ... "
                        Mad scientists at Harvard encode GIF into bacteria DNA        ,"July 13, 2017",Fernando Ramirez,"        The ground-breaking achievement was made possible using ""CRISPR,"" a complicated genome editing tool that scientists believe could one day treat HIV, remove Malaria from mosquitoes and even cure cancer.     "
"                        Move over, B.o.B.: 11 famous people who believe crazy things        ","January 27, 2016",Kyrie O’Connor,"        Foo Fighters  The band led by Dave Grohl has expressed skepticism about the link between the HIV virus and AIDS, and have done concerts for that cause.     "
                        First look at rapper Trae Tha Truth's emoji set        ,"July 19, 2016",Joey Guerra,"        It offers school supplies and backpacks, immunizations and HIV testing -- all free of charge.     "
                        NIH study: Adult HIV drug may also work for teens        ,"September 5, 2017",Amanda Cuda,"        ""Our study suggests that this therapy can safely reduce HIV risk for those under 18."" ... When the NIH study began, participants ranging in age from 15 to 17 years old were not infected with HIV, and were ... "
                        Rent will have you rocking with Houston's finest young talent        ,"July 26, 2015",None,"        Based loosely on Puccini's La Boheme, Jonathan Larson's Rent follows a year in the life of a group of impoverished young artists and musicians struggling to survive and create music in New York's Lower East Side, under the shadow of HIV/AIDS.     "
                        Fun facts about 'Forrest Gump' 23 years after its release in theaters        ,"July 6, 2017",Craig Hlavaty,        Film fans still debate whether Jenny dies of HIV/AIDS at the end of the film.     
                        Sixth annual Galveston Restaurant Week now in full swing        ,"January 5, 2017",Mike D. Smith,"        Proceeds from the fixed-price breakfast, brunch, lunch and dinner specials will benefit Access Care of Coastal Texas, a group that provides services to people living with HIV and AIDS.     "
                        The Motley Fool: Do losses add up to profits?        ,"July 12, 2016",The Motley Fool,"        I'm a global biopharmaceutical company, focused on hepatitis C, HIV, diabetes, immuno-oncology and global pandemics, such as Ebola.     "
"                        Houston sports celebrities, local artists team up for ""Sport4Life""        ","August 2, 2014",Submitted,"        The fundraising event offers a new and unique play to the organization's annual art auction by adding to its roster the help of professional and amateur athletes to raise awareness of HIV/AIDS, reduce the stigma ... "
                        James Carper        ,"February 1, 2014",None,"        James (Jimmy) Carper, 66, of Houston, Texas passed away on Monday, January 27, 2014 of complications from HIV/AIDS and advanced COPD.Jimmy is preceded in death by his parents, one brother, as well as his partner of 32 years, Dr.     "
                        Forum: We have a path to end HIV - and we could throw it away        ,"August 20, 2017",Karina Danvers,"        We have a path to end HIV - and we could throw it away By Karina Danvers At first glance, you might wonder why I'm an HIV activist. ... San Francisco, which was ravaged by HIV/AIDS in the 1980s and 1990s, ... "
                        Legacy Community Health Services to hold Mint Julep on July 21        ,"June 24, 2013",None,"        According to a press release from Legacy Community Health Services, ""This event is for everybody that is willing to have a good time and recognize the LGBT people and organizations that support Legacy's HIV/AIDS ... "
                        Aetna accidentally exposed customer HIV statuses in clear envelope windows        ,"August 25, 2017",Samantha Schmidt,"        The letters were sent to customers taking medications for HIV treatment as well as for Pre-exposure prophylaxis (PrEP), which helps prevent HIV, according to the legal groups. ... Despite medical advances, ... "
"                        Bering Omega marks its 25th year of compassionate care, services        ","August 18, 2011",Submitted,"        Submitted For 25 years, Bering Omega Community Services has provided compassionate care and services to individuals living with HIV/AIDS in the Houston community. ... Bering Omega Community Services is a ... "
                        Local organizations to donate to in the wake of Hurricane Harvey        ,"September 6, 2017",Heather Leighton,"        LGBTQ Hurricane Harvey Disaster Relief Fund The Montrose Center created a disaster fund for the LGBTQ community to ""help homeless youth, seniors, people living with HIV, hate crime survivors, and those ... "
                        Mother loses over 100 pounds to get back at cheating husband        ,"December 30, 2016",Fernando Ramirez,"        DeNiro in the 1980 film, 'Raging Bull' Emmy Nominations Matthew McConaughey went from buff to barely-there for his role as Ron Woodroof -- a man diagnosed with AIDS in the height of the HIV epidemic in the ... "
                        Artist creates portrait of former pope out of condoms        ,"July 2, 2015",Daniela Sternitzky-Di Napoli,        The last exhibition was Wednesday June 27 on National HIV Testing Day and will continue until they run out of condoms to hand out.      
                        Mexican orphans' plight prompts Pearland man's toy drives        ,"December 15, 2015",Don Maines,"        Five years ago, Gonzalez organized a school supply drive for children living with or affected by HIV. ... ""We offer free HIV and syphilis testing,"" he said.     "
"                        Business, politics seize new market at Pride Festival        ","June 28, 2014",Bobby Blanchard,"        ""Project Runway All Stars"" season one winner Mondo Guerra and Houston native and photographer Duane Cramer were working to raise HIV awareness through the ""I Design"" campaign, which encourages people to talk ... "
"                        Insurer Aetna Reveals HIV Status in Mailing to 12,000 (1)        ","August 24, 2017",Zachary Tracer,"        He is the fourth person on PrEP to contract HIV, and experts are baffled by the phenomenon. ... Experts believe that the man could not have been following his drug regiment, could have been exposed to someone ... "
"                        Free stuff to do, June 23-29        ","June 22, 2016",Houston Chronicle,"        The festival features over 200 exhibitors like the Houston LGBT History exhibit, Family Fun Zone, Health and Wellness Pavillion, Free HIV testing and entertainment. ( Gary Coronado / Houston Chronicle ) Howard Harris Howard Harris Entertainment    "
                        Houston Pride is on display        ,"June 21, 2017",Joey Guerra,"        The festival features over 200 exhibitors like the Houston LGBT History exhibit, Family Fun Zone, Health and Wellness Pavillion, Free HIV testing and entertainment. ( Gary Coronado / Houston Chronicle ) Entertainment    "
                        Real people: Holiday Schmooze for Legacy continues to grow        ,"December 15, 2016",Judi Griggs,"        Started in 1997, the Holiday Schmooze is a two-hour cocktail party held in a private Houston residence to raise money for HIV/AIDS programs and services.     "
"                        Insurer Aetna reveals HIV status of clients in mailing to 12,000        ","August 24, 2017",Zachary Tracer,"        Information about the HIV medication was visible through a plastic window in some cases, according to Aetna. ... Individuals with HIV can face ""widespread stigma,"" including discrimination in employment, housing ... "
                        Still much to be done in HIV fight        ,"November 26, 2016",Michele A. Rountree and Bart Whittington,        Rountree and Bart Whittington Much work still undone in the fight against HIV Michele A. ... Cities across Texas should replicate San Francisco's Getting to Zero initiative in which a multisector consortium ... 
"                        AIDS virus targets lengthy list of proteins, study shows        ","January 11, 2008",Associated Press,"HIV is on its face a simple virus, consisting of just nine genes. ... The proteins it exploits have been dubbed HIV dependency factors, and 36 had been discovered. ... But most of today's AIDS drugs work by targeting the HIV virus itself.     "
                        American killed in Mali worked to improve global health        ,"November 21, 2015",The Associated Press,"        As a public health expert, she focused on family planning and HIV issues, work that took her to Africa often in the past 15 years.     "
                        David's Dream Run set for Saturday at Woodforest Stadium        ,"May 7, 2014",Kimberly Sutton,"        All proceeds from the one-mile and 5K run/walk go to the David Center, which is part of the Allergy and Immunology Clinic which provides care in many areas, including: allergy, asthma, immune dysfunction, and HIV/AIDS.     "
                        Study: Herpes drug helps tame AIDS virus        ,"February 22, 2007",Associated Press,"        Associated Press Treating genital herpes can also help keep the AIDS virus under control in women with both infections, and might reduce the spread of HIV, too, the first major study to test this strategy ... "
                        Friendswood's Dev Banerji completes Peace Corps service        ,"April 17, 2013",None,"        Along with Banerji's primary duties, his other work involved secondary projects such as HIV/AIDs education/prevention and a recycling awareness project.     "
                        Fitness blogger turned ovarian cancer fighter chronicles her battle on Instagram to raise awareness        ,"December 13, 2016",Heather Leighton,"        Viruses such as Epstein-Barr, chronic infection with Hepatitis B or C, HIV type 1, HPV types 16, 18, 31, 33, 35, 39, 45, 51, 52, 56, 58, 59 and 66 How likely?     "
"                        Cue the music, cue the drama! Lee Daniels introduces 'Star'        ","December 12, 2016",Frazier Moore,"        ""I'm 57 (on Christmas Eve) and I'm alive, without HIV, and that's a miracle: I watched so many friends die in my arms, many of whom I had slept with.     "
                        Midtown's San José Clinic offering affordable medical care for uninsured Harvey victims        ,"September 13, 2017",Darla Guillen,"        LGBTQ Hurricane Harvey Disaster Relief Fund The Montrose Center created a disaster fund for the LGBTQ community to ""help homeless youth, seniors, people living with HIV, hate crime survivors, and those ... "
                        Texas woman's 'extreme couponing' provides thousands in goods for Harvey victims        ,"September 13, 2017",Darla Guillen,"        LGBTQ Hurricane Harvey Disaster Relief Fund The Montrose Center created a disaster fund for the LGBTQ community to ""help homeless youth, seniors, people living with HIV, hate crime survivors, and those ... "
                        A blue pill is stopping HIV from Sydney to San Francisco        ,"August 18, 2017",Jason Gale,"HIV diagnoses at the U.K.'... FDA HIV DRUG.JPEG-050fc This photo provided by Gilead Sciences shows Truvada. ... HIV Prevention Pills ﻿A new study shows that Truvada pills, used to treat HIV infection, also can ... "
"                        Shelburne, Shamoo and Arias: We must be smarter about antibiotics use        ","December 6, 2016",Samuel Shelburne III,"        Building from the experience of Harris County Public Health in tackling infectious diseases such as HIV and tuberculosis, we should devote a similar approach to mitigating antimicrobial resistance in our community.     "
                        The best sports photos from 2017        ,"December 11, 2017",Fernando Alfonso III,"        Fernando Alfonso III, Houston Chronicle Conor McGregor getting slammed in the face, a cowboy getting thrown from a bull, and Usain Bolt falling in agony were some of the most gripping sports images this year. ... "
                        Houston-area organizations you can donate to for Hurricane Harvey relief        ,"September 7, 2017",Heather Leighton,"        LGBTQ Hurricane Harvey Disaster Relief Fund The Montrose Center created a disaster fund for the LGBTQ community to ""help homeless youth, seniors, people living with HIV, hate crime survivors, and those ... "
"                        Argument at Anna golf course leaves one man dead, another in jail        ","December 1, 2016",William Axford,"        Source: CDC Tuberculosis Most distinctive cause of death in: Texas Legal intervention Most distinctive cause of death in: Oregon, Nevada, Utah Whataburger Bust Accidental discharge of firearm Most distinctive ... "
                        Miley Cyrus named new spokesperson for MAC cosmetics        ,"October 30, 2014",Daily Dish,"        All proceeds from the limited edition lipstick line will benefit the MAC AIDS Fund, which helps men, women and children living with and affected by HIV/AIDS.     "
                        Social media supports safe sex with #CondomChallenge        ,"December 6, 2015",Heather Leighton,"        ""The advent of HIV/AIDS in the 1980s may have influenced sexual attitudes and behaviors. ... Later-born GenX'ers and Millennials - who reported fewer partners than those born in the 1950s and 1960s - became ... "
"                        Smith: Watt, Altuve lift Houston even higher        ","December 5, 2017",Brian T. Smith,"        ., baseball's consecutive games played record Sportsman 1994.jpg 1994 Sports Illustrated Sportspeople of the Year Bonnie Blair, Johann Olav Koss, Olympic gold medalists Sportsman 1993.jpg 1993 Sports Illustrated ... "
"                        J.J. Watt, Jose Altuve named Sportspersons of Year by Sports Illustrated        ","December 4, 2017",David Barron,"        ., baseball's consecutive games played record Sportsman 1994.jpg 1994 Sports Illustrated Sportspeople of the Year Bonnie Blair, Johann Olav Koss, Olympic gold medalists Sportsman 1993.jpg 1993 Sports Illustrated ... "
                        LPD: Man robbing store threatened employees with syringe tainted with HIV ,"August 12, 2017",César Rodriguez,"        Cesar Rodriguez A man threatened loss prevention personnel from Sears with a syringe tainted with HIV as he tried exiting the store with unpaid merchandise, according to Laredo police. ... The man, Hernandez, ... "
                        5 takeaways from the Trump opioid commission report - and what it leaves out        ,"August 3, 2017",James A. Baker III Institute for Public Policy,"        The report also did not mention several harm reduction strategies, such as syringe-exchange programs and safe injection sites, both of which reduce overdoses and the spread of HIV/HepC, and put users in contact with important health services.     "
                        The Philippines' drug policy problem        ,"October 25, 2016",James A. Baker III Institute for Public Policy,"        In addition, the region has some of the highest rates of HIV and Hepatitis C infections among drug users in the world, and while some countries have adopted harm reduction policies to deal with this problem, ... "
"                        9 dangerous diseases that could be prevented by vaccines within the next decade, from HIV to cancer        ","January 1, 2018",Lydia Ramsey,"        Lydia Ramsey, provided by REUTERS/Karoly Arvai One of the best defenses we have against viral infections is the vaccine. Vaccines prepare the body's immune system to fight an incoming infection; they've been ... "
                        Harris County Attorney Vince Ryan seeks to stop sale of 'Miracle Mineral Solution'        ,"May 9, 2016",Community report,"        Despite this, MMS is promoted by Hawkins and others as a ""miracle"" substance that can cure cancer, diabetes, autism, HIV/AIDS, Parkinson's disease, Alzheimer's, Hepatitis and even the common cold.     "
                        Harris County Attorney Ryan seeks to stop sale of 'Miracle Mineral Solution'        ,"May 9, 2016",None,"        Despite this, MMS is promoted by Hawkins and others as a ""miracle"" substance that can cure cancer, diabetes, autism, HIV/AIDS, Parkinson's disease, Alzheimer's, Hepatitis and even the common cold.     "
