Title,Date,Author,Content
                        Thomas Street Health Center Gives Life to Patients Living with HIV/AIDS        ,"December 11, 2018",StoryStudio,"        It was the first freestanding HIV/AIDS clinic in the nation. ... All patient mentors are HIV positive. ... They tell you, 'I also have HIV,'"" said Boodwhani.      "
                        Fake doctor in India suspected of infecting dozens with HIV ,"February 6, 2018",NEW YORK TIMES,"        NEW YORK TIMES NEW DELHI - Police officials in northern India were searching on Tuesday for a fake doctor suspected of infecting dozens of his patients with HIV by reusing a dirty syringe. ... At least 33, they ... "
                        Trump ends terms of remaining members of HIV and AIDS Council        ,"December 30, 2017",New York Times,"HIV, AIDS council members ousted Advocacy groups assail removal of federal advisers New York Times The Trump administration this past week dismissed the remaining members of a federal advisory council on HIV and ... "
                        Woman learns she has HIV but refuses to inform her ex        ,"August 5, 2016",Abby,"        Woman refuses to tell ex she has HIV By Abby Dear Abby: My friend ""Camilla"" recently learned she is HIV positive. ... Camilla hasn't been unfaithful, and it is clear she has been HIV positive for some time.     "
                        Study finds HIV-positive live longer when engaged in 'spiritual thinking'        ,"May 10, 2016",Allan Turner,"        Allan Turner A study published in the Journal of General Internal Medicine finds that HIV-positive men and women had a longer survival rate if they engaged in spiritual practices and thinking, an article in The ... "
                        WHO pushes for millions more to get HIV treatment        ,"September 30, 2015",NEW YORK TIMES,"        NEW YORK TIMES Everyone who has HIV should immediately be put on antiretroviral triple therapy and everyone at risk of becoming infected should be offered protective doses of similar drugs, the World Health ... "
HIV-positive woman hiding status from men        ,"July 6, 2015",Abby,"        At the time, a friend of mine had found out she was HIV-positive. ... We have reconnected, but I have recently learned she had several relationships and didn't reveal that she was HIV-positive or use protection. ... "
"                        Record-breaking ""Hairspray"" inspired drag show raises $100,000 toward HIV/AIDS vaccine        ","July 16, 2018",Amber Elliott,"        Cormier and fellow co-chairs Tony Bravo, Linda Cantu and Ben Dillon hit a winning note; by end of day, their fundraising efforts totaled $100,000 for the federally-qualified health center's HIV/AIDS programs, ... "
                        Houston man who infected ex-girlfriend with HIV sentenced to 30 years in prison        ,"June 21, 2018",Dana Burke,"        In April 2014, the woman began to experience symptoms of HIV, court records show. ... OPINION: Texas needs to work to end state's HIV problem In September 2014, during treatment for an oral thrush infection ... "
"                        Galveston County clinic officials speak up about possible patient exposure to HIV, hepatitis        ","March 27, 2018",Nick Powell,"        ""Let me just say this, we see all patients, we see patients with Hep C, Hep B and HIV and we take the proper precautions when we see each and every patient,"" Howard said. ... The health district estimated that ... "
"                        Patients at 2 Galveston County health clinics may have been exposed to HIV, hepatitis        ","March 23, 2018",Nick Powell,"        No infections found, but county has 'significant concern' about those who had dental procedures By Nick Powell A Galveston-based health clinic chain may have infected patients with the hepatitis B virus, ... "
                        Girl's HIV infection seems under control without AIDS drugs        ,"July 24, 2017",MARILYNN MARCHIONE,        Current treatments keep HIV under control but must be taken lifelong. ... The previous cases: -A French teen who was born with HIV and is now around 20 has had her infection under control despite no HIV ... 
"                        Maxwell: Meth and HIV: a new, Texas-size problem        ","August 3, 2016",Jane Maxwell,"        Specifically in Texas, this new methamphetamine epidemic appears intertwined with increases in yet another problem: sexually transmitted diseases, including HIV. ... We need to confront these intertwined ... "
HIV Prevention Summit aims to help reduce new HIV infections in Houston area        ,"January 30, 2016",Community report,"        Community report In conjunction with efforts to reduce new HIV infections across the nation, researchers at Baylor College of Medicine will host the PrEP Houston HIV Prevention Summit to help inform healthcare ... "
                        Charlie Sheen predicted HIV diagnosis in dream        ,"January 7, 2016",Daily Dish,        Celebrity Buzz Daily Dish TODAY - Pictured: Charlie Sheen - (Peter Kramer/NBC/NBCU Photo Bank via Getty) Charlie Sheen predicted his HIV diagnosis in a dream more than 20 years before it became reality. ... 
                        Sex offender who gave 15-year-old HIV learns punishment        ,"March 17, 2016",None,"        A repeat sex offender who infected a 15-year-old victim with HIV was sentenced to life in prison Thursday after being convicted of sexual assault of a child. ... During her closing arguments, prosecutor Katie ... "
                        Celebs react to Charlie Sheen's HIV announcement        ,"November 18, 2015",Nick Paschal,"        Tubular Nick Paschal ""What Just Happened"": In an interview with Matt Lauer on ""The Today Show"" Tuesday, Charlie Sheen revealed he's HIV positive.     "
                        Charlie Sheen: 'I am HIV positive'        ,"November 17, 2015",Daily Dish,"        Celebrity Buzz Daily Dish Actor Charlie Sheen waits on the set of the Today Show before formally announcing that he is H.I.V. positive in an interview with Matt Lauer on November 17, 2015 in New York City. ... "
                        June 27 marks HIV Testing Day        ,"June 25, 2015",Andrea Waguespack,"        Andrea Waguespack, Houston Chronicle June 27 marks National HIV Testing Day. ... Take a look at the slideshow to see which famous people have been affected by HIV or AIDS. Famous people with HIV or AIDS Former ... "
                        GHBA Remodelers Council: Remodeling can improve lives        ,"May 26, 2019",Amy Ahlbrand Robinson,"        Lydia's Place offers 15 single-room-occupancy apartments to recovering, drug-free males, 18 years of age or older, who are living with HIV/AIDS.     "
                        Texas to stop funding Planned Parenthood program aimed at preventing HIV ,"December 22, 2015",Brian M. Rosenthal,"        Rosenthal AUSTIN -- Texas state officials announced this week they no longer will fund a long-standing Planned Parenthood program that has conducted 140,000 HIV tests and given out 300,000 condoms to Houston ... "
"HIV is treatable, but only if you know you're positive        ","November 30, 2015",Abby,"        With effective treatment, people with HIV can live as long as those without HIV. ... People with HIV who are in treatment need never develop advanced HIV (formerly full-blown AIDS). ... HIV can affect anyone.     "
                        Free HIV/AIDs testing offered        ,"February 8, 2014",None,"        The University of Houston-Clear Lake's Black Student Association and the Office of Intercultural Student Services encourage you to know your status by attending the free HIV/AIDs screening Feb. 20, 2 p.m. - 7 ... "
                        Dine Out April 30 to fight HIV/AIDS in Houston        ,"March 27, 2015",Community Reports,"        ""We have a chance to end HIV/AIDS within our lifetime"" explains Kelly Young, Chief Executive Officer of AIDS Foundation Houston. ""Dining Out for Life not only raises money to end HIV/AIDS but also raises ... "
                        Danny Pintauro tells Oprah he's HIV-positive        ,"September 28, 2015",Daily Dish,        Celebrity Buzz Daily Dish google_share_inline|celebrity_buz Entertainment > Celebrities    
                        Charlie Sheen among other celebrities affected by HIV/AIDS        ,"November 17, 2015",Andrea Waguespack,"        Andrea Waguespack, Houston Chronicle After the rumor mill was spinning for days about which so-called famous womanizer contracted HIV, Charlie Sheen went on ""Today"" to tell the world he is HIV-positive -- a ... "
                        'Rent' teenagers get crash course on the show's background of HIV/AIDS devastation        ,"September 2, 2015",Don Maines,"        In contrast, ""Rent"" is billed as a raw depiction of 1990s ""bohemian life in New York City's East Village under the shadow of the HIV/AIDS virus."" ... Founded in 1982, AFH was the first organization in Texas ... "
HIV Funding VS Abstinence Programs in Texas        ,"April 9, 2015",Mustafa Tameez,        In The Loop Mustafa Tameez Texas lawmakers are looking to cut funding from HIV and STD programs to further fund abstinence education in schools. Texas has the 3rd largest HIV rates in the country. Taking money ... 
HIV in the Middle East: Women at risk        ,"June 30, 2014",James A. Baker III Institute for Public Policy,"HIV and AIDS in the Middle East and North Africa. ... Setayesh et al., HIV and AIDS, 5. 5. Setayesh et al., HIV and AIDS, 4. 6.     "
                        Police seek partners of sex offender with HIV ,"October 24, 2014",Michelle Iracheta,        Houston news He's accused of giving the disease to two girls he raped By Michelle Iracheta Houston police are searching for people who may have had contact with a convicted sex offender accused of raping two ... 
                        Reality-TV star reveals he has HIV ,"October 1, 2014",Dana Thompson,"        According to reports, Donato said on Wednesday's episode that he's HIV positive. ... Famous people with HIV or AIDS Former ""Two and a Half Men"" star Charlie Sheen Keep clicking to see other celebrities who have been diagnosed with HIV or AIDS.     "
                        Charlie Sheen spent over $10 million keeping HIV a secret        ,"November 17, 2015",Daily Dish,        Celebrity Buzz Daily Dish Pictured: (Left to right) Matt Lauer and Charlie Sheen - (Photo by: Peter Kramer/NBC via Getty Images) Charlie Sheen is struggling financially after spending upwards of $10 million ... 
                        Famous people with HIV or AIDS        ,"June 24, 2013",Chron.com staff,"        By Chron.com staff By Chron.com staff Famous people with HIV/AIDS Famous people with HIV or AIDS Former ""Two and a Half Men"" star Charlie Sheen Keep clicking to see other celebrities who have been diagnosed with HIV or AIDS.     "
                        Dine out on April 30 to fight HIV/AIDS in Houston        ,"March 27, 2015",Community Report,"        Guests interested in supporting AIDS Foundation Houston through Dining Out for Life can enjoy breakfast, lunch or dinner throughout the day at a variety of restaurants, with a percentage of sales from the day ... "
                        Researchers identify good bacteria that protects against HIV ,"March 29, 2014",None,"        These good bacteria, in turn, create a physical and chemical barrier to bad bacteria and viruses including HIV. ... Their laboratory model will allow careful and controlled evaluation of the complex community of ... "
                        Exchange plans not protecting HIV positive patients with affordable care        ,"November 28, 2014",Brian Hujdich,"        Today, 1.1 million Americans live with HIV. ... But it's especially challenging for those with HIV. ... Brian Hujdich is the executive director of HealthHIV, a national HIV non-profit organization.     "
                        Stem Cell Treatment Has UC Davis A Step Closer To HIV Cure        ,"January 17, 2015",Chron.tv,        Watch This Chron.tv Stem Cell Treatment Has UC Davis A Step Closer To HIV Cure    
                        Hispanic community faces HIV threat        ,"October 12, 2012",Guillermo Chacon,"        Chacon op-ed Hispanics facing HIV threat Chacon op-ed By Guillermo Chacon HIV/AIDS is a significant health threat to the Hispanic/Latino community in the United States, affecting every segment of the country. ... "
                        Social media could be used to track HIV ,"February 26, 2014",markgladstone,"        Data on HIV cases that the researchers linked the tweets to came from aidsvu.org, which logged HIV prevalence from 2009. ... On a per capita basis, the largest raw number of HIV-risk related tweets came from the ... "
                        Cambodia Finds 212 With HIV Where Unlicensed Medic Operated        ,"January 10, 2015",Chron.tv,        Watch This Chron.tv Cambodian health authorities have found 212 villagers infected with HIV in a district where an unlicensed medic has been charged with murder on suspicion of spreading the virus with ... 
"                        Man cycling for hemophilia, HIV ","June 13, 2012",Matt Stephens,"        ""(The ride) is also geared toward doing what I can to eliminate stigma that comes along with HIV,"" said Haarde, who contracted HIV at age 13. ""Many people think that HIV is a horrible disease that people die ... "
"                        Get tested for HIV, says black women's advocate        ","February 19, 2014",Kyrie O’Connor,"        Get tested for HIV, advocate says By Kyrie O'Connor Demetria L. ... ""Black women are still the fastest-rising group"" for contracting HIV, she said, even if the stats are getting better. ... Lucas is afraid that ... "
                        On a mission to prevent HIV among children        ,"March 20, 2013",Todd Ackerman,"        Q: How frequent is the transmission of the HIV virus from mother to baby? ... Before we had anything to offer pregnant women with HIV or their babies, pre-1985, only 20 to 25 percent acquired HIV. ... We're ... "
                        Planning begins for Camp For All 2020 Gala        ,"May 23, 2019",Roy Kent,"        Camp For All attendees have challenges including ""cancer, autism, muscular dystrophy, epilepsy, severe burns, sickle cell, cerebral palsy, cognitive challenges, cardiac issues, PKU, NF, HIV, dermatological issues, spinal cord injuries and more.     "
                        Toga Party raised funds for HIV/AIDS support        ,"July 21, 2014",Amber Elliott,        Bering Omega was founded in 1986 to provide support and resources for those affected by HIV/AIDS in the greater Houston area.     
HIV-positive sex-assault suspect may have had contact with others        ,"October 24, 2014",Mike Glenn,"        In both cases, the victims were infected with HIV and herpes. ... Police said Wilson did not know he had HIV when he allegedly assaulted the baby, but he was aware of his condition in the other case. ... "
                        Famous people with HIV or AIDS in honor of National HIV testing day        ,"June 24, 2013",Francisca Ortega,"        It is the only way you can know for sure if you have HIV or an STD. We now have very effective treatments for HIV. ... If you have HIV or STDs, you can help your partner get tested.     "
                        Martin Sheen breaks down as he praises son Charlie over HIV announcement        ,"November 18, 2015",Daily Dish,"        (Jason LaVeris/FilmMagic) Hollywood veteran Martin Sheen fought back tears as he praised his son Charlie Sheen for his ""courage"" after he went public with his HIV diagnosis. ... Charlie's father Martin has now ... "
                        The Luke Church goes global to stand against HIV/AIDS        ,"July 20, 2014",Community Reports,"        Sloan generated headlines about an issue most churches refuse to discuss, HIV/AIDS, by not only leading an initiative but also getting a rapid HIV test in front of his congregation of 5,000 members. ... Openly ... "
                        Houston area observing National HIV Testing Day        ,"June 27, 2013",Carol Christian,"        By Carol Christian Thursday is National HIV Testing Day. First observed on June 27, 1995, the day was established as a way to promote HIV awareness and testing. In Houston, the city's Health and Human Services ... "
"                        Letters: Chemicals, ethanol, HIV pill        ","May 11, 2012",Copyright 2012: Houston Chronicle,"        Arthritis pain Regarding ""FDA panel backs first pill to block HIV"" (Page A7, Friday), that is a fine drug for preventing HIV, which affects just over a million people.     "
                        BASKETBALL: Sterling stirs new dispute with Magic-HIV remarks        ,"May 13, 2014",The Associated Press,        The Associated Press LOS ANGELES - An interview that was supposed to be an attempt at rehabilitation instead had Los Angeles Clippers owner Donald Sterling facing fresh rebukes as he went from apologizing for ... 
HIV cases rising in West Virginia county        ,"May 27, 2019",None,"        (AP) - A cluster of HIV cases in Cabell County reflects a shift in how the disease is being transmitted, West Virginia health officials say. ... HIV cases are still comparatively sparse in West Virginia. ... As ... "
                        The Luke hosts second HIV/AIDS Awareness        ,"March 4, 2013",From Community Reports,        Luke Missionary Baptist Church of Humble (The Luke) will host its' second HIV/AIDS Awareness Town Hall Meeting in an effort to bring education and awareness to the issue of HIV/AIDS in churches and community. ... 
"                        68,000 in Texas live with HIV ","December 27, 2011",Associated Press,"        68 000 in Texas live with HIV Associated Press VICTORIA - An estimated 68,000 Texans have the human immunodeficiency virus that causes AIDS, about an 8 percent increase over the past two years. ... About 4,200 ... "
                        Letters: Optimism and AIDS/HIV ,"December 5, 2010",HOUSTON CHRONICLE,        The fact that Texas ranks third in the nation in cases of HIV/AIDS diagnosed among young people ages 13-19 and fourth in the nation in cases of HIV/AIDS diagnosed among people of all ages is unacceptable. ... 
"HIV/AIDS patients in Deep South have lower survival rates, says Duke University study        ","January 14, 2015",Community Reports,"        They are also more likely to attribute their HIV infection to heterosexual sex. ""This research documents the dire consequences that having an HIV diagnosis in the Deep South region has for too many individuals,"" ... "
                        NAACP and churches push HIV awareness        ,"July 8, 2012",Tabatha Bognar,"        tabatha.bognar@chron.com Norman Mitchell, left, performs an HIV test on the Rev. ... Norman Mitchell, left, performs an HIV test on the Rev. ... DaMarion Lewis has blood drawn for the HIV test at St.     "
"                        Man cycling for hemophilia, HIV awareness        ","June 14, 2012",Matt Stephens,"        ""(The ride) is also geared toward doing what I can to eliminate stigma that comes along with HIV,"" said Haarde, who contracted HIV at age 13. ""Many people think that HIV is a horrible disease that people die ... "
"                        Ryan White, the hemophiliac teen who contracted HIV, remembered 25 years after death        ","April 8, 2015",Andrea Waguespack,"        Take a look at celebrities who were also diagnosed with HIV and/or AIDS. ... RELATED: Celebrities who've been diagnosed with HIV/AIDS The CDC reports that in 2013, an estimated number of diagnoses of HIV ... "
"                        Attacker reveals HIV to victim afterward, prosecutors say        ","November 30, 2012",Robert Stanton,"        By Robert Stanton A Houston man drugged and sexually assaulted a man he met at nightclub in June - then informed the victim that he was HIV positive, according to Harris County prosecutors. ... ""After the sexual ... "
                        NAACP sponsors day for HIV/AIDS education        ,"July 12, 2013",Anita Hassan,"        Health Zone Anita Hassan On Sunday, 100 faith leaders from around the country are to preach about HIV and the AIDS virus as a social justice issue.  The Day of Unity, sponsored by the National Association for ... "
                        Texas researchers aim for lifelong HIV vaccine        ,"November 20, 2012",Richard A. Marini,"        Marini SAN ANTONIO - In addition to a cure for HIV, a top priority of AIDS researchers is a vaccine that can prevent infection. ... These cells are injected with attenuated, or dead, pieces of the HIV, ... "
                        Free HIV tests available Oct. 13        ,"September 25, 2012",None,        The Latino HIV Task Force will offer free HIV tests Oct. 13 as part of the National Latino AIDS Awareness Day. The task force will offer the HIV tests from 11 a.m.-4 p.m. at the Association for the Advancement ... 
                        The Luke takes a stand for HIV/AIDS awareness        ,"September 4, 2012",From Community Reports,        Luke Missionary Baptist Church of Humble will host an HIV/AIDS Awareness Town Hall Meeting in an effort to bring education and awareness to the issue of HIV/AIDS in churches and the community. ... Sherri Onyiego ... 
                        Police: Pakistani man kills HIV positive wife in south        ,"May 29, 2019",None,"        Wednesday's incident took place in the town of Sikarpur, 75 kilometers (45 miles) northeast of Larkana district, which has been struck by an HIV epidemic. ... Local police chief Sajid Siddozai says the woman ... "
                        Experimental drug may one day cut risk of HIV ,"March 4, 2014",markgladstone,"        “This is the most exciting innovation in the field of HIV prevention that I’ve heard recently,” said Dr. ... “If it works and proves to be safe, it would allow for HIV to be prevented with periodic ... "
                        Prosecutors push for HIV test for nurse accused of rape        ,"May 24, 2019",None,        PHOENIX (AP) - Prosecutors are asking the Arizona Court of Appeals to reject arguments that an order for a nurse accused of raping and impregnating an incapacitated patient at a long-term care center to take an HIV test is unconstitutional.     
"                        UT-Austin, Stanford researchers strive to develop way to combat HIV ","January 24, 2013",Erin Mulvaney,"        Houston news By Erin Mulvaney A new study details a method of cutting and pasting cells of the immune system so they could become resistant to HIV infection, possibly replacing patients' current drug treatments. ... "
                        Alicia Keys backing women's HIV education initiative        ,"April 16, 2013",dailydish@sfgate.com (Daily Dish),"        Celebrity Buzz dailydish@sfgate.com (Daily Dish) Noel Vasquez/Getty Images Singer Alicia Keys met with women with HIV at a Washington, D.C. health center on Monday to discuss the stigma and fear associated with ... "
                        NAACP launches new strategy to fight HIV ,"July 7, 2012",Cindy George,"        Houston is considered one the nation's HIV/AIDS ""hot spots."" About 22,000 people with HIV live in the greater Houston area. ... Harris County ranked No. 1 among counties for new HIV infections, AIDS cases and ... "
                        A coming of age for kids with HIV HIV: One-pill treatment helps A coming of age for kids with HIV ,"June 27, 2011",Cindy George,"        Are there people with HIV getting married? ... ""It's not like I can help having HIV. ... Babies born with HIV died.     "
"                        Man cycling 3,700 miles for hemophilia, HIV ","June 7, 2012",Matt Stephens,"        ""[The ride] is also geared toward doing what I can to eliminate stigma that comes along with HIV,"" said Haarde, who contracted HIV at age 13. ""Many people think that HIV is a horrible disease that people die ... "
                        Study shows HIV treatment outcomes of undocumented Hispanic patients        ,"March 28, 2013",None,"        The study consisted of 1,620 HIV-infected adults, including 186 undocumented Hispanic patients, 278 documented Hispanic patients, 986 black patients and 170 white patients. ... ""This shows us that programs that ... "
                        Charlize Theron discusses HIV/AIDs with South African president        ,"July 29, 2013",dailydish@sfgate.com (Daily Dish),        Celebrity Buzz dailydish@sfgate.com (Daily Dish) (Photo by Craig Nieuwenhuizen/Foto24/Gallo Images/Getty Images) Actress Charlize Theron met with South African President Jacob Zuma on Monday to discuss his ... 
                        New HIV screenings in Kanawha for at-risk populations        ,"May 22, 2019",None,        (AP) - Four Kanawha County agencies are banding together to provide HIV screenings and education for at-risk populations. ... A press release says people can start getting tested for HIV on May 29 at Covenant ... 
                        Rise in youth HIV cases found in Austin        ,"June 14, 2012",Francisca Ortega,        Mom Houston Francisca Ortega Teen pregnancy not the only possible scary outcome of teen sex Here's a story that's sure to terrify any parent of a teen or pre-teen: Travis County health officials have found an ... 
                        Officials try to hold costs in HIV drug program        ,"June 26, 2011",ASSOCIATED PRESS,"        ASSOCIATED PRESS,ASSOCIATED PRESS AUSTIN - State officials overseeing an HIV medication program will seek ways to contain costs after the program failed to get money from the Legislature to make up a projected ... "
