Title,Date,Author,Content
                        Houston news        ,"January 24, 2018",Todd Ackerman,        Varon said the leading example of different treatment for homosexual patients that survey respondents acknowledged was ordering HIV-AIDS testing without the patient's consent.     
                        Pearland man receives Governor's Criminal Justice Volunteer Service Award        ,"April 18, 2016",None,        Selzer has dedicated himself since 2008 to educating offenders about Human Immunodeficiency Virus (HIV) by providing educational support and interacting with the staff at multiple units throughout TDCJ. His ... 
"                        Corrections for Dec. 17, 2014        ","December 16, 2014",From staff reports,"        From staff reports 1 A story on Page A1 Monday about an HIV book for children misidentified Sheryl McCurdy, a faculty member at the University of Texas School of Public Health.     "
                        MD Anderson wants name removed from cancer conference materials        ,"February 5, 2018",Todd Ackerman,"        The article also notes that Ramdev has ""courted controversy over claims that he had cured over 1,000 cancer and HIV patients through the practice of yoga and concoctions marketed by his pharmacy, Patanjali.""     "
"                        Ashley Jadine Foundation organizes annual health fair, walk at St. Mary's        ","September 21, 2016",Staff report,"        The event will include face painting, vendors, exhibitors, a variety of entertainment - DJ, Zumba with the Texan YMCA, snacks and drinks, Brentwood Baptist Church Brigade for Christ Drill Team, free flu shots ... "
"                        Foundation hosts annual health fair, walk        ","September 20, 2016",Staff report,"        The event will include face painting, vendors, exhibitors, a variety of entertainment - DJ, Zumba with the Texan YMCA, snacks and drinks, Brentwood Baptist Church Brigade for Christ Drill Team, free flu shots ... "
                        Illnesses that have been conquered by science        ,"March 20, 2018",William Axford / Houston Chronicle,"        Those who have HIV/AIDS, low body weight, organ transplants, head and neck cancer should especially be vigilant against this illness.      "
                        Cancer breakthrough? 97 percent of mice cured in Stanford vaccine study        ,"February 2, 2018",Ted Andersen,"        Viruses such as Epstein-Barr, chronic infection with Hepatitis B or C, HIV type 1, HPV types 16, 18, 31, 33, 35, 39, 45, 51, 52, 56, 58, 59 and 66 How likely?     "
                        Prominent Houston women you need to know about in 2018        ,"March 13, 2018",William Axford / Houston Chronicle,"        She developed the allergy-related drug for asthma Xolair and TNX-355, an antibody for HIV/AIDS.     "
                        Starbucks workers in Seattle claim that dangerous needle pokes and HIV-prevention drugs have become a routine part of working at the coffee giant (SBUX)        ,"October 3, 2018",Kate Taylor,        Several Starbucks workers in Seattle say that they're encountering hypodermic needles on the job nearly every day and that they've had to take antiviral medications to protect themselves from HIV and hepatitis. ... 
                        Lawyer: Harris County jailer raped Katy woman after pot arrest        ,"May 4, 2018",St. John Barned-Smith,"        She had to begin a regimen of harsh preventative medication to address potential HIV exposure, and start seeing a psychiatrist.     "
                        Charlie Sheen's ex: 'I'm clean'        ,"November 16, 2015",Daily Dish,"        ""There are speculations circling that one of my ex boyfriends from years ago may have contracted the HIV virus,"" she wrote, not naming Sheen. ... Meanwhile, sources tell ""Access Hollywood"" that Sheen's ex-wife ... "
                        12 best memes mocking 'Pharma Bro' Martin Shkreli        ,"June 26, 2017",Beatrice Verhoeven,"        Shkrelli, the former CEO of Turing Pharmaceuticals, grew to notoriety in 2015 after raising the price of Daraprim, a life-saving drug used to treat HIV from $13.50 per pull to $750 per pill - a 5,000 percent increase.     "
"                        Yale study: Drug for opioid, alcohol abuse may help suppress HIV ","June 4, 2018",Register Staff,"        Sandra Springer, an associate professor at the medical school who specializes in HIV/AIDS and addiction, gave extended-release naltrexone or a placebo to 100 people who were both HIV positive and who had abused ... "
                        ABC correspondent comes out as HIV positive        ,"March 24, 2018",Matt Donnelly,"        Read original story ABC Correspondent Comes Out as HIV Positive, Says Industry Peers Warned: 'Don't, It'll Ruin You' At TheWrap Karl Schmid came out as HIV positive on Friday night in a Facebook post. Click ... "
                        Pride Houston says over 700K attended weekend festival and parade        ,"June 29, 2015",Craig Hlavaty,"        The festival features over 200 exhibitors like the Houston LGBT History exhibit, Family Fun Zone, Health and Wellness Pavillion, Free HIV testing and entertainment. ... The festival features over 200 exhibitors ... "
                        Downtown rings with echoes of Pride Festival after legalization of same-sex marriage        ,"June 27, 2015",Mark Collette,"        The festival features over 200 exhibitors like the Houston LGBT History exhibit, Family Fun Zone, Health and Wellness Pavillion, Free HIV testing and entertainment. ... The festival features over 200 exhibitors ... "
                        Houston Pride Festival has added tinge of celebration after marriage win        ,"June 27, 2015",Dug Begley,"        The festival features over 200 exhibitors like the Houston LGBT History exhibit, Family Fun Zone, Health and Wellness Pavillion, Free HIV testing and entertainment. ... The festival features over 200 exhibitors ... "
                        Nine countries have issued health warnings for the plague        ,"October 26, 2017",Heather Leighton,HIV/AIDs: Wikipedia hard numbers ... ... Over 1.1 million people are estimated to be currently living with HIV in the U.S. ... Photo: Magic Johnson's announcement that he has H.I.V. did much to dispel the attitude that AIDS was gay disease.     
                        Five Fast Facts about PARAGARD® (intrauterine copper contraceptive)        ,"June 22, 2016",Brandpoint (BPT),        PARAGARD® does not protect against HIV or STDs. ... PARAGARD® does not protect against HIV or STDs. 1. ... PARAGARD® does not protect against HIV or STDs.     
                        FRANK CLEMENTE: Big Pharma's blockbuster tax cuts        ,"December 11, 2017",Frank Clemente,"        Among the biggest spikes: the retail price of Pfizer's nerve medication Lyrica doubled, while the price paid by Medicaid for Johnson & Johnson's HIV treatment Prezista was up 131 percent.     "
                        Third Annual Run for Rand: Making a 'cross-country' difference        ,"May 5, 2016",None,"        With over half its population unemployed, Port Shepstone experiences poverty, low levels of education and high health risks, including HIV/AIDS and tuberculosis. ... The mission of The Genesis Trust is to serve ... "
                        AIDS Foundation Houston laces up for 26th Annual AIDS Walk 2015        ,"February 1, 2015",Community Reports,"        AIDS Walk Houston which takes place Sunday, March 8th, 2015 at Sam Houston Park Downtown is the city's single greatest response in the fight against HIV/AIDS. A goal of $600K has been set and more than 10,000 ... "
                        Houston Legal Links 11/6/2017        ,"November 6, 2017",Mary Flood,        Judge Questions HHA CEO's Credibility for Trying to Evict Seniors Texas Court Sides With Convict In Contract Dispute With Atty (Law360) Ex-Baylor Employee's Testimony Limited Over Student Info In Sex Assault ... 
                        Sex offender accused in rapes of 2 girls        ,"October 23, 2014",Mike Glenn,"        In both cases, the victims were infected with HIV and herpes. ... Each complied and only Wilson's test results came back positive for HIV. ... The teenager also tested positive for herpes and HIV, officials said.     "
                        At the forefront of civil rights        ,"March 21, 2014",Paulina Rojas,"        At that time, many medical experts still thought HIV was an airborne disease. ... Anyone with HIV may schedule a 30-minute legal consultation in English or Spanish. ... Katine has done a lot of work advocating ... "
"                        PrEP could help end new HIV infections completely, but barriers remain        ","August 3, 2018",Brian Zahn,"        However, the CDC estimated in March that slightly more than 8 percent of the estimated 1.1 million Americans at substantial risk for HIV filled prescriptions for PrEP in 2015. ... According to state data, from ... "
                        Want fewer people to die from an opioid overdose? Give them heroin (assisted treatment)        ,"July 17, 2017",James A. Baker III Institute for Public Policy,"        The most well-known is the Swiss model, which began in 1994 in response to a persistent open-air heroin market and the spread of HIV through needle sharing. ... Criminal activity and new incidences of hepatitis ... "
                        Caitlyn Jenner's MAC beauty collection debuts        ,"January 4, 2017",Joy Sewing,        The partnership is fitting for the makeup brand that made RuPaul the first Viva Glam spokesperson back in 1994 to raise awareness and fund for HIV and AIDS.     
                        Gayle: Progress continues in fight against AIDS        ,"May 12, 2014",Helene D. Gayle,"        Anti-retroviral treatments were approved for use in HIV treatment in 1995. That same year, the CDC began recommending routine HIV screening of pregnant women. ... Today, a 20-year-old diagnosed with HIV can expect to live 50 years.     "
                        Omega House Hospice Program director to be honored        ,"October 31, 2016",Staff Report,"        The award, named for the co-founding director of Sing For Hope, was created by the Bering Omega Board of Trustees to recognize an individual or organization that has made a significant contribution to improve ... "
"                        Remember these illnesses? Probably not, thanks to science        ","March 21, 2018",William Axford,"        Those who have HIV/AIDS, low body weight, organ transplants, head and neck cancer should especially be vigilant against this illness.      "
                        Attorney: HIV test request violated client's privacy        ,"February 16, 2018",Dirk Perrefort,        By Dirk Perrefort DANBURY - An attorney representing Bruce Bemer - a Glastonbury businessman facing human trafficking charges - argued Friday that the state broke the law when it named his client in its request ... 
                        World's last male northern white rhino dies in Kenyan reserve        ,"March 20, 2018",Paul Richardson,"        (AP Photo/Riccardo Gangale, File) TOPSHOTS Members of Maasai Cricket Warriors, a cricket team famed for using the sport to raise awareness for HIV/AIDS, women's issues and now the devastating effects of poaching ... "
                        Houston Legal Links 6/22/2017        ,"June 22, 2017",Mary Flood,        The answer isn't easy Lambda lawyer explains why he and five others quit president's HIV/AIDS council Vault 100 Rankings: The Most Prestigious Law Firms In America (2018) President Of Washington Bar Association ... 
                        Naked crack-smoking woman tries to spit on Dallas police during arrest        ,"September 23, 2016",William Axford,"        Will Axford, Houston Chronicle A naked Dallas woman high on crack cocaine tried to spit on officers sent to arrest her because she thought they would get HIV. ... READ MORE: Dallas man incriminates himself by ... "
                        Prominent Houston women you need to know about in 2018        ,"March 13, 2018",William Axford,"        She developed the allergy-related drug for asthma Xolair and TNX-355, an antibody for HIV/AIDS.     "
                        Are dating apps to blame for an increase in STDs?        ,"May 27, 2015",Tony Bravo,"        A survey conducted by the department revealed that from 2013 to 2014, cases of syphilis rose by 79 percent, gonorrhea by 30 percent and HIV by almost 33 percent. ... They also warned that even though infection ... "
                        Barbara Bush visited our facility for children with HIV/AIDS.         ,"April 21, 2018",Debbie Tate and Joan McCarley,"        The White House had approved of our request to invite a group of men living with HIV/AIDS to meet the first lady. ... Thanks to the spotlight Bush afforded us, we became an international model for 24-hour ... "
"HIV-infected people are living for years, but age-related diseases set in early        ","April 16, 2018",Marlene Cimons,"HIV medications control HIV but don't cure it. ... ""This is hard for anyone, with or without HIV, but probably more important if you've got HIV."" ... What is it about HIV that hastens the process?     "
                        The Motley Fool: Paying too much for overvalued stocks?        ,"September 13, 2016",The Motley Fool,"        It has an enormously valuable portfolio of drugs focused on treatments for HIV, hepatitis B and hepatitis C, and has made a series of acquisitions over the last several years that have expanded its presence in ... "
"                        Annual World AIDS Day luncheon attended by Mayor Turner raised $150,000        ","December 1, 2016",Amber Elliott,"        Alessandro Grattoni, Ph.D., associate member of Houston Methodist's Research Institute, received the Shelby Hodge Vision Award for his work to reduce the burden of HIV and its infection rate. ... The long-time ... "
                        Houston senator asks DOJ to protect rights of gay Texans        ,"June 29, 2015",Lauren McGaughy,"        The festival features over 200 exhibitors like the Houston LGBT History exhibit, Family Fun Zone, Health and Wellness Pavillion, Free HIV testing and entertainment. ... The festival features over 200 exhibitors ... "
                        Dr. Helen Heslop named director of Center for Cell and Gene Therapy        ,"April 1, 2016",Community report,"        Its comprehensive approach brings a wide variety of scientists and clinicians together to develop strategies for the treatment of cancer, HIV and cardiovascular disease.     "
"                        Galveston County sees increase in STDs, according to newly released data        ","April 19, 2017",Darla Guillen,"        In 2015, there were 54 reported cases of HIV and 28 cases of AIDS in Galveston County. Both saw more HIV and AIDS cases in 2015 that in 2014.  District STD-HIV control services manager Jim Hilton told the ... "
                        AIDS Foundation Houston's annual Dining Out for Life set for April 28        ,"April 1, 2016",None,"        A portion of the proceeds support AFH's programs and services that help thousands of Houstonians living with HIV/AIDS. ... ""We can end HIV/AIDS within our lifetime, and Dining Out for Life helps raise funds and ... "
                        Pride shines through Houston as supporters celebrate SCOTUS ruling        ,"June 27, 2015",Jon Shapley,"        The festival features over 200 exhibitors like the Houston LGBT History exhibit, Family Fun Zone, Health and Wellness Pavillion, Free HIV testing and entertainment. ... The festival features over 200 exhibitors ... "
                        Q&A: Medology CEO skips traditional route to success        ,"November 1, 2017",Jenny Deam,"        You can go to our site and buy a lab test; you can buy an allergy test, you can buy an HIV test.     "
                        Online medical service Medology seeks a revolution in care        ,"November 1, 2017",Jenny Deam,"        While he demurs on the volume of business, Pirani offers an example of the urgency of his service: ""We diagnose an HIV infection once a day,"" he said, adding that the online confidentiality of his service offers ... "
"                        Study: Children inherit 'geeky' traits from parents, especially older fathers        ","June 26, 2017",Darla Guillen,"HIV/AIDS Men were more likely to contract HIV in the early stages of the disease's emergence, according to the World Health Organization. Globally, however, the number of adults living with HIV/AIDs is about even.     "
                        New exhibit lends help to HIV/AIDS crisis        ,"January 17, 2018",Alexandra Villarreal,"        And so the mothers had to choose: Possibly give their newborns HIV/AIDS, or watch them starve to death. ... Some 120,000 Venezuelans had HIV in 2016, based on statistics from UNAIDS. ... All of the art has been ... "
                        The Power of Children: Making a Difference opens Feb. 1 at Altharetta Yeargin Art Museum        ,"January 26, 2016",None,"        When school officials learned of his condition, Ryan was banned from returning to school because of fears and misconceptions associated with HIV/AIDS. ... Today, the Ryan White HIV/AIDS Program provides care and treatment for people with HIV/AIDS.     "
                        Community Health & Wellness Center provides free HIV testing        ,"April 5, 2018",Patricia Martin,"        Torrington Free HIV testing available at health center By Patricia Martin TORRINGTON - Community Health and Wellness Center provides free, confidential HIV testing at both its Torrington and Winsted locations. ... "
"                        A Silicon Valley startup with Chelsea Clinton on its board is launching the first at-home test for an HIV prevention drug, and you can try it right now        ","August 15, 2018",Erin Brodwin,"        It's also a big deal for people seeking HIV-prevention drugs, who currently battle stigma and potentially wait months to get the medication. ... ""This is a game-changing step towards preventing the spread of ... "
                        Trump raises possibility of withdrawing drug czar nominee        ,"October 16, 2017",MATTHEW DALY,"        In a letter to Trump, Manchin called the opioid crisis ""the biggest public health crisis since HIV/AIDS,"" and said, ""we need someone leading the White House Office of National Drug Control Policy who believes we ... "
                        Houston commemorates 25th annual AIDS Walk        ,"February 19, 2014",Submitted,        Submitted AIDS Foundation Houston (AFH) continues to be at the forefront of HIV/AIDS as it gears up to host the city's single greatest response in the fight against the epidemic. ... One out of 93 people in ... 
HIV vaccine may be on horizon        ,"July 24, 2017",Amanda Cuda,"        ""A safe and effective HIV vaccine would be a powerful tool to reduce new HIV infections worldwide and help bring about a durable end to the HIV/AIDS pandemic,"" said NIAID Director Dr. ... The Future of HIV ... "
                        Yale study finds HIV drug effective in mice        ,"January 8, 2018",Amanda Cuda,"        In collaboration with Priti Kumar's lab at Yale, the drug candidate was tested in mice with transplanted human blood cells and infected with HIV. In the humanized mice, the compound achieved key goals of HIV ... "
                        San Antonio sets high goal for people to get HIV test in April        ,"April 5, 2018",Melissa Fletcher Stoeltje,"        Nationally, 1 in 7 people with HIV are unaware they have the virus. ... Metro Health has joined a national campaign called Fast-Track Cities, which encourages municipalities to achieve the following 90-90-90 ... "
                        Is it OK for first-year doctors to work 28 hours in a row? New rule says it's fine.        ,"August 3, 2017",April Dembosky,"        The patient had HIV and hepatitis C. ... After nearly a year of periodic checks, she's been officially declared negative for HIV and hepatitis C.     "
                        Trump: Drug czar nominee pulls his name        ,"October 17, 2017",Darlene Superville and Matthew Daly,"        In a letter to Trump, Manchin called the opioid crisis ""the biggest public health crisis since HIV/AIDS,"" and said, ""we need someone leading the White House Office of National Drug Control Policy who believes we ... "
                        How much a doctor's visit cost in the U.S. vs. other countries        ,"October 16, 2017",Fernando Ramirez,"        Rare Twins Hospital birth cost U.S. cost: $10,808 Spain: $1,950 Switzerland: $7,751 Australia: $5,312 Arthritis medication - 28 day supply of Humira U.S. cost: $2,669 Spain: $1,253 Switzerland: $822  ... "
                        Buzzfeed: Grindr sharing users' HIV status and location with third-party companies        ,"April 2, 2018",Alyssa Pereira,"        SINTEF, a Norwegian nonprofit and research organization, was the first to notice that users' HIV status was being shared. ... The HIV status is linked to all the other information. ... I think this is the ... "
                        PAUL KAWATA: Obamacare's growing pains        ,"November 21, 2013",PAUL KAWATA,"        According to CDC data: There were 47,300 new HIV infections (in America) 2010 Approximately 1.1 million people are living with HIV in the U.S. Since the beginning of the domestic epidemic 658,992 people have ... "
                        Activists denounce Trump's firing of HIV/AIDS council        ,"December 30, 2017",Eugene Scott,"        The council, whose members are not paid, has advised the White House on HIV/AIDS policies for more than two decades, specifically offering recommendations on the National HIV/AIDS Strategy, a five-year plan ... "
                        Legacy Community Health to screen pregnant women for Zika virus        ,"February 6, 2016",None,"        Legacy's roots began in 1981 as the Montrose Clinic, with specialization in HIV education, testing and treatment. Since then, the agency has expanded to include adult primary care, HIV/AIDS care, pediatrics, ... "
                        Positive news        ,"July 22, 2011",None,"        Houston was one of 25 U.S. cities with high HIV rates that participated in the $111 million project, which provided almost 2.8 million HIV tests and diagnosed 18,432 individuals who were previously unaware they ... "
                        HomeAid accomplishments set pace for 2017        ,"January 19, 2017",None,"        This year there are three Care projects planned: A Caring Safe Place, a housing center for men who are HIV positive, with substance abuse and/or mental illness will be renovated; Agape Development will receive a ... "
                        The challenge remains: A way to prevent AIDS        ,"December 1, 2010",HANA EL SAHLY,"        Even in the United States, the dramatic success of the HIV medications to reduce hospitalizations and mortality was not mirrored by successes in the areas of transmission reduction and HIV prevention. ... A ... "
                        March through history with photos of Houston's Pride Parade through the years        ,"June 14, 2018",Fernando Alfonso III,"        The festival features over 200 exhibitors like the Houston LGBT history exhibit, family fun zone, health and wellness pavillion, free HIV testing and entertainment.     "
                        Baylor clinic committed to AIDs battle in Africa        ,"September 5, 2014",Robert M. Ricketts,"        Ricketts From February 2013 to February of this year, I worked at a pediatric HIV clinic in Maseru, Lesotho. ... Yet, this story is much more personal to me even as the situation has global significance in the ... "
                        Houstonians seeking to better the world get support from banking giant        ,"June 7, 2017",Andrea Leinfelder,"        RELATED: BBVA Compass charts a virtual course in U.S. expansion The Houstonians in the program are: A Caring Safe Place, Stanley Phill: A Caring Safe Place develops, constructs and operates transitional and ... "
                        Meet the man leading the charge against the global HIV/AIDS epidemic        ,"March 28, 2018",Tom Fox,"        Q: What brought you to the CDC and fight against HIV/AIDS? ... Q: What has your work fighting HIV/AIDS meant to you personally and professionally? A: When I started in 1990, there was only one drug to treat HIV/AIDS.     "
                        Sandcastle teams with HomeAid on charity project        ,"June 2, 2017",None,"        Sandcastle Homes teamed with HomeAid Houston, a 501(c)(3) charity of the Greater Houston Builders Association (GHBA), to remodel a transitional living facility for A Caring Safe Place, an agency that provides ... "
                        Burt Reynolds: 'Charlie Sheen does not deserve my sympathy'        ,"December 8, 2015",Daily Dish,"        (SAV/GC Images) Veteran actor Burt Reynolds has sparked a storm by confessing he has no sympathy for Charlie Sheen over his HIV diagnosis, insisting the Hollywood wild man ""deserved it."" ... Charlie Sheen ... "
"                        Celebrities who have been open about their disease, health issues        ","September 28, 2017",Carolina Gonzales,        Charlie Sheen The actor told the world in 2015 that he was HIV positive.     
                        Condom dispute highlights dangers of HIV among seniors        ,"December 5, 2017",Steve Hughes,"        He also questioned state statistics on the spread of HIV among seniors. ... But half the population living with HIV/AIDS is older than 50, and in the greater Capital Region recent data is showing a higher level ... "
